{
	"$schema": "https://json-schema.org/draft-07/schema",
	"description": "schema of a meta-stream",
	"type": "object",
	"required": [
		"$schema",
		"info",
		"device",
		"fields",
		"streams"
	],
	"additionalProperties": false,
	"properties": {
		"$schema": {
			"type": "string"
		},
		"info": {
			"$ref": "dfs.schema.json#/definitions/info"
		},
		"device": {
			"$ref": "dfs.schema.json#/definitions/device"
		},
		"fields": {
			"$ref": "dfs.schema.json#/definitions/fields"
		},
		"streams": {
			"$ref": "dfs.schema.json#/definitions/streams"
		}
	}
}